{"schema":"https://debz.dev/schema/native-transaction-authorization-v2","version":2,"backend":"native","target_architecture":"amd64","foreign_architectures":[],"install_root":"/srv/root","root_identity_sha256":"1b292ed83668a7231965384ce66f907a5ebd141db7f6f127fe3cad8ef6589b90","request_sha256":"0000000000000000000000000000000000000000000000000000000000000000","solver_policy_sha256":"1111111111111111111111111111111111111111111111111111111111111111","executor_policy_sha256":"0303030303030303030303030303030303030303030303030303030303030303","plan_sha256":"0404040404040404040404040404040404040404040404040404040404040404","exact_lock":{"schema":"https://debz.dev/schema/exact-closure-lock-v3","version":3,"digest_sha256":"9d3535edadd65511998ac3e2b55707cd65860d4d72445879214eb387645c21eb"},"policy":{"conffile":"keep_existing","force":[],"allow_host_root":false},"actions":[{"sequence":0,"kind":"install","package":{"name":"seed","version":"1","architecture":"all"},"prior_version":null,"artifact":{"archive_identity":{"primary":"sha512","digests":[{"algorithm":"sha256","digest":"2222222222222222222222222222222222222222222222222222222222222222"},{"algorithm":"sha512","digest":"33333333333333333333333333333333333333333333333333333333333333333333333333333333333333333333333333333333333333333333333333333333"}]},"size":1,"origin":{"type":"local_artifact","artifact_id":{"algorithm":"sha512","digest":"33333333333333333333333333333333333333333333333333333333333333333333333333333333333333333333333333333333333333333333333333333333"},"archive_identity":{"primary":"sha512","digests":[{"algorithm":"sha256","digest":"2222222222222222222222222222222222222222222222222222222222222222"},{"algorithm":"sha512","digest":"33333333333333333333333333333333333333333333333333333333333333333333333333333333333333333333333333333333333333333333333333333333"}]},"size":1,"package":{"name":"seed","version":"1","architecture":"all"},"acquisition_url":"https://example.invalid/seed.deb","trust_mode":"pinned_content_digest"}}}],"trigger_authority":null,"final_state":[{"name":"seed","version":"1","architecture":"all","state":"installed","dpkg_selection_hold":false,"triggers_pending":[],"triggers_awaited":[]}],"final_state_sha256":"447c799f80f89b4036fcb734ed188866a7d8dccb881fc22d0bd40a19f217c0ac","digest_sha256":"d10399f4ed78c139668ad19080e2e94dd2a70c4f646f4c1a9b5ac5449be507a2"}